movie_id,title,overview,poster_path,rating,genres
1197306,A Working Man,"Levon Cade left behind a decorated military career in the black ops to live a simple life working construction. But when his boss's daughter, who is like family to him, is taken by human traffickers, his search to bring her home uncovers a world of corruption far greater than he ever could have imagined.",https://image.tmdb.org/t/p/w500//xUkUZ8eOnrOnnJAfusZUqKYZiDu.jpg,6.284,"Action, Crime, Thriller"
668489,Havoc,"When a drug heist swerves lethally out of control, a jaded cop fights his way through a corrupt city's criminal underworld to save a politician's son.",https://image.tmdb.org/t/p/w500//r46leE6PSzLR3pnVzaxx5Q30yUF.jpg,6.696,"Action, Crime, Thriller"
950387,A Minecraft Movie,"Four misfits find themselves struggling with ordinary problems when they are suddenly pulled through a mysterious portal into the Overworld: a bizarre, cubic wonderland that thrives on imagination. To get back home, they'll have to master this world while embarking on a magical quest with an unexpected, expert crafter, Steve.",https://image.tmdb.org/t/p/w500//iPPTGh2OXuIv6d7cwuoPkw8govp.jpg,6.193,"Family, Comedy, Adventure, Fantasy"
324544,In the Lost Lands,"A queen sends the powerful and feared sorceress Gray Alys to the ghostly wilderness of the Lost Lands in search of a magical power, where she and her guide, the drifter Boyce, must outwit and outfight both man and demon.",https://image.tmdb.org/t/p/w500//t6HJH3gXtUqVinyFKWi7Bjh73TM.jpg,6.322,"Fantasy, Adventure, Action"
1276073,Bullet Train Explosion,"When panic erupts on a Tokyo-bound bullet train that will explode if it slows below 100 kph, authorities race against time to save everyone on board.",https://image.tmdb.org/t/p/w500//qkTKtOHK9JEEOHgPQZ0dFtzs5ML.jpg,6.635,"Action, Thriller, Crime, Drama"
1092899,The Siege,"International assassin Walker is compromised during a mission and sent to a reassignment center for a new identity. During his stay at the facility, a ruthless assault team storms the compound searching for someone their boss has lost. Walker begrudgingly falls in with skilled hitwoman Elda and her mysterious ward Juliet in order to survive the night.",https://image.tmdb.org/t/p/w500//hVh4hMzkXNLnScudbid6hDvjMPk.jpg,5.333,"Action, Thriller"
822119,Captain America: Brave New World,"After meeting with newly elected U.S. President Thaddeus Ross, Sam finds himself in the middle of an international incident. He must discover the reason behind a nefarious global plot before the true mastermind has the entire world seeing red.",https://image.tmdb.org/t/p/w500//pzIddUEMWhWzfvLI3TwxUG2wGoi.jpg,6.155,"Action, Thriller, Science Fiction"
1180906,Desert Dawn,A newly appointed small-town sheriff and his begrudging deputy get tangled up in a web of lies and corruption involving shady businessmen and the cartel while investigating the murder of a mysterious woman.,https://image.tmdb.org/t/p/w500//S21BfLrJSD9njucBfY3CKqp8rD.jpg,0.0,"Action, Crime, Mystery, Thriller"
1233413,Sinners,"Trying to leave their troubled lives behind, twin brothers return to their hometown to start again, only to discover that an even greater evil is waiting to welcome them back.",https://image.tmdb.org/t/p/w500//fWPgbnt2LSqkQ6cdQc0SZN9CpLm.jpg,7.619,"Action, Horror, Thriller"
974576,Conclave,"After the unexpected death of the Pope, Cardinal Lawrence is tasked with managing the covert and ancient ritual of electing a new one. Sequestered in the Vatican with the Catholic Church’s most powerful leaders until the process is complete, Lawrence finds himself at the center of a conspiracy that could lead to its downfall.",https://image.tmdb.org/t/p/w500//l4WXg5oQPK6GVlISKQNIUGb8rKJ.jpg,7.209,"Drama, Thriller, Mystery"
931349,Ash,A woman wakes up on a distant planet and finds the crew of her space station viciously killed. Her investigation into what happened sets in motion a terrifying chain of events.,https://image.tmdb.org/t/p/w500//5Oz39iyRuztiA8XqCNVDBuy2Ut3.jpg,5.491,"Science Fiction, Horror, Thriller"
1045938,G20,"After the G20 Summit is overtaken by terrorists, President Danielle Sutton must bring all her statecraft and military experience to defend her family and her fellow leaders.",https://image.tmdb.org/t/p/w500//wv6oWAleCJZUk5htrGg413t3GCy.jpg,6.619,"Action, Mystery, Drama"
1195506,Novocaine,"When the girl of his dreams is kidnapped, everyman Nate turns his inability to feel pain into an unexpected strength in his fight to get her back.",https://image.tmdb.org/t/p/w500//xmMHGz9dVRaMY6rRAlEX4W0Wdhm.jpg,6.89,"Action, Comedy, Thriller"
1124620,The Monkey,"When twin brothers find a mysterious wind-up monkey, a series of outrageous deaths tear their family apart. Twenty-five years later, the monkey begins a new killing spree forcing the estranged brothers to confront the cursed toy.",https://image.tmdb.org/t/p/w500//yYa8Onk9ow7ukcnfp2QWVvjWYel.jpg,5.864,"Horror, Comedy"
1083968,Locked,"When Eddie breaks into a luxury SUV, he steps into a deadly trap set by William, a self-proclaimed vigilante delivering his own brand of twisted justice. With no means of escape, Eddie must fight to survive in a ride where escape is an illusion, survival is a nightmare, and justice shifts into high gear.",https://image.tmdb.org/t/p/w500//hhkiqXpfpufwxVrdSftzeKIANl3.jpg,6.1,"Horror, Thriller"
1244944,The Woman in the Yard,"In the aftermath of her husband's death, widow Ramona's struggle to raise her two kids is hindered by the arrival of a mysterious woman with supernatural abilities.",https://image.tmdb.org/t/p/w500//n0WS2TsNcS6dtaZKzxipyO7LuCJ.jpg,6.0,"Horror, Mystery"
1293286,Gunslingers,"When the most wanted man in America surfaces in a small Kentucky town, his violent history -- and a blood-thirsty mob seeking vengeance and a king’s ransom -- soon follow. As brothers face off against one another and bullets tear the town to shreds, this lightning-fast gunslinger makes his enemies pay the ultimate price for their greed.",https://image.tmdb.org/t/p/w500//O7REXWPANWXvX2jhQydHjAq2DV.jpg,6.7,"Western, Action"
1241982,Moana 2,"After receiving an unexpected call from her wayfinding ancestors, Moana journeys alongside Maui and a new crew to the far seas of Oceania and into dangerous, long-lost waters for an adventure unlike anything she's ever faced.",https://image.tmdb.org/t/p/w500//aLVkiINlIeCkcZIzb7XHzPYgO6L.jpg,7.08,"Animation, Adventure, Family, Comedy"
762509,Mufasa: The Lion King,"Mufasa, a cub lost and alone, meets a sympathetic lion named Taka, the heir to a royal bloodline. The chance meeting sets in motion an expansive journey of a group of misfits searching for their destiny.",https://image.tmdb.org/t/p/w500//lurEK87kukWNaHd0zYnsi3yzJrs.jpg,7.415,"Adventure, Family, Animation"
939243,Sonic the Hedgehog 3,"Sonic, Knuckles, and Tails reunite against a powerful new adversary, Shadow, a mysterious villain with powers unlike anything they have faced before. With their abilities outmatched in every way, Team Sonic must seek out an unlikely alliance in hopes of stopping Shadow and protecting the planet.",https://image.tmdb.org/t/p/w500//d8Ryb8AunYAuycVKDp5HpdWPKgC.jpg,7.726,"Action, Science Fiction, Comedy, Family"
1403735,Laila,"Sonu Model, a renowned beautician from the old city, is forced to disguise himself as Laila, leading to a series of comedic, romantic, and action-packed events. Chaos ensues in this hilarious laugh riot",https://image.tmdb.org/t/p/w500//l4gsNxFPGpzbq0D6QK1a8vO1lBz.jpg,5.0,"Comedy, Romance"
870028,The Accountant 2,"When an old acquaintance is murdered, Wolff is compelled to solve the case. Realizing more extreme measures are necessary, Wolff recruits his estranged and highly lethal brother, Brax, to help. In partnership with Treasury Agent Marybeth Medina, they uncover a deadly conspiracy, becoming targets of a ruthless network of killers who will stop at nothing to keep their secrets buried.",https://image.tmdb.org/t/p/w500//ieYaJz2nzs4wcqpWaofagzGoGPi.jpg,7.233,"Crime, Thriller, Action"
299536,Avengers: Infinity War,"As the Avengers and their allies have continued to protect the world from threats too large for any one hero to handle, a new danger has emerged from the cosmic shadows: Thanos. A despot of intergalactic infamy, his goal is to collect all six Infinity Stones, artifacts of unimaginable power, and use them to inflict his twisted will on all of reality. Everything the Avengers have fought for has led up to this moment - the fate of Earth and existence itself has never been more uncertain.",https://image.tmdb.org/t/p/w500//7WsyChQLEftFiDOVTGkv3hFpyyt.jpg,8.2,"Adventure, Action, Science Fiction"
315635,Spider-Man: Homecoming,"Following the events of Captain America: Civil War, Peter Parker, with the help of his mentor Tony Stark, tries to balance his life as an ordinary high school student in Queens, New York City, with fighting crime as his superhero alter ego Spider-Man as a new threat, the Vulture, emerges.",https://image.tmdb.org/t/p/w500//c24sv2weTHPsmDa7jEMN0m2P3RT.jpg,7.3,"Action, Adventure, Science Fiction, Drama"
420818,The Lion King,"Simba idolizes his father, King Mufasa, and takes to heart his own royal destiny. But not everyone in the kingdom celebrates the new cub's arrival. Scar, Mufasa's brother—and former heir to the throne—has plans of his own. The battle for Pride Rock is ravaged with betrayal, tragedy and drama, ultimately resulting in Simba's exile. With help from a curious pair of newfound friends, Simba will have to figure out how to grow up and take back what is rightfully his.",https://image.tmdb.org/t/p/w500//dzBtMocZuJbjLOXvrl4zGYigDzh.jpg,7.111,"Adventure, Drama, Family, Animation"
1059073,Winter Spring Summer or Fall,"Remi and Barnes, two very different teenagers, meet by chance in the winter of their senior year, then spend four  days together over the course of a year that will change their lives forever.",https://image.tmdb.org/t/p/w500//mEPi5ISa5RmzpzeDfwkhX0CcNsf.jpg,7.583,"Romance, Comedy, Drama"
696506,Mickey 17,"Unlikely hero Mickey Barnes finds himself in the extraordinary circumstance of working for an employer who demands the ultimate commitment to the job… to die, for a living.",https://image.tmdb.org/t/p/w500//edKpE9B5qN3e559OuMCLZdW1iBZ.jpg,6.915,"Science Fiction, Comedy, Adventure"
321612,Beauty and the Beast,A live-action adaptation of Disney's version of the classic tale of a cursed prince and a beautiful young woman who helps him break the spell.,https://image.tmdb.org/t/p/w500//hKegSKIDep2ewJWPUQD7u0KqFIp.jpg,6.971,"Family, Fantasy, Romance"
11,Star Wars,Princess Leia is captured and held hostage by the evil Imperial forces in their effort to take over the galactic Empire. Venturesome Luke Skywalker and dashing captain Han Solo team together with the loveable robot duo R2-D2 and C-3PO to rescue the beautiful princess and restore peace and justice in the Empire.,https://image.tmdb.org/t/p/w500//6FfCtAuVAW8XJjZ7eWeLibRLWTw.jpg,8.204,"Adventure, Action, Science Fiction"
283995,Guardians of the Galaxy Vol. 2,The Guardians must fight to keep their newfound family together as they unravel the mysteries of Peter Quill's true parentage.,https://image.tmdb.org/t/p/w500//y4MBh0EjBlMuOzv9axM4qJlmhzz.jpg,7.612,"Science Fiction, Adventure, Action"
181808,Star Wars: The Last Jedi,"Rey develops her newly discovered abilities with the guidance of Luke Skywalker, who is unsettled by the strength of her powers. Meanwhile, the Resistance prepares to do battle with the First Order.",https://image.tmdb.org/t/p/w500//kOVEVeg59E0wsnXmF9nrh6OmWII.jpg,6.779,"Adventure, Action, Science Fiction"
1125899,Cleaner,"When a group of radical activists take over an energy company's annual gala, seizing 300 hostages, an ex-soldier turned window cleaner suspended 50 storeys up on the outside of the building must save those trapped inside, including her younger brother.",https://image.tmdb.org/t/p/w500//mwzDApMZAGeYCEVjhegKvCzDX0W.jpg,6.599,"Action, Thriller"
1373723,The Codes of War,"War stories about family, ethics and honor include the true story of two U.S. Marines who in a span of six seconds, must stand their ground to stop a suicide truck bomb, a Navy Corpsman who attempts to hold on to his humanity, and a WW2 soldier who gets separated from his squad and is forced to re-evaluate his code.",https://image.tmdb.org/t/p/w500//oXeiQAfRK90pxxhP5iKPXQqAIN1.jpg,6.2,"Action, War"
335984,Blade Runner 2049,"Thirty years after the events of the first film, a new blade runner, LAPD Officer K, unearths a long-buried secret that has the potential to plunge what's left of society into chaos. K's discovery leads him on a quest to find Rick Deckard, a former LAPD blade runner who has been missing for 30 years.",https://image.tmdb.org/t/p/w500//gajva2L0rPYkEWjzgFlBXCAVBE5.jpg,7.578,"Science Fiction, Drama"
209112,Batman v Superman: Dawn of Justice,"Fearing the actions of a god-like Super Hero left unchecked, Gotham City’s own formidable, forceful vigilante takes on Metropolis’s most revered, modern-day savior, while the world wrestles with what sort of hero it really needs. And with Batman and Superman at war with one another, a new threat quickly arises, putting mankind in greater danger than it’s ever known before.",https://image.tmdb.org/t/p/w500//5UsK3grJvtQrtzEgqNlDljJW96w.jpg,6.0,"Action, Adventure, Fantasy"
293167,Kong: Skull Island,"Explore the mysterious and dangerous home of the king of the apes as a team of explorers ventures deep inside the treacherous, primordial island.",https://image.tmdb.org/t/p/w500//r2517Vz9EhDhj88qwbDVj8DCRZN.jpg,6.5,"Action, Adventure, Fantasy"
1353117,Home Sweet Home: Rebirth,"When a city is overrun with a demonically-possessed crowd, a cop must find the source of evil to save his family.",https://image.tmdb.org/t/p/w500//9rCBCm9cyI4JfLEhx3EncyncMR3.jpg,6.557,"Horror, Fantasy, Thriller, Mystery, Action"
1252309,Ask Me What You Want,"After his father's death, Eric Zimmerman travels to Spain to oversee his company's branches. In Madrid, he falls for Judith and engage in an intense, erotic relationship full of exploration. However, Eric fears his secret may end their affair.",https://image.tmdb.org/t/p/w500//k82T5L1utX1G2LhNWeza9nGUKPk.jpg,5.9,"Romance, Drama"
218,The Terminator,"In the post-apocalyptic future, reigning tyrannical supercomputers teleport a cyborg assassin known as the ""Terminator"" back to 1984 to kill Sarah Connor, whose unborn son is destined to lead insurgents against 21st century mechanical hegemony. Meanwhile, the human-resistance movement dispatches a lone warrior to safeguard Sarah. Can he stop the virtually indestructible killing machine?",https://image.tmdb.org/t/p/w500//hzXSE66v6KthZ8nPoLZmsi2G05j.jpg,7.664,"Action, Thriller, Science Fiction"
1201176,Easter Bloody Easter,A woman must protect her small town from the Jackalope (based on the mythical rabbit-antelope creature of North American folklore) and his army of devilish bunnies as they embark on a murder spree over the Easter weekend.,https://image.tmdb.org/t/p/w500//8tGYZlPttiOjEe61GvszRcrnpEi.jpg,4.5,"Horror, Comedy, Fantasy"
348,Alien,"During its return to the earth, commercial spaceship Nostromo intercepts a distress signal from a distant planet. When a three-member team of the crew discovers a chamber containing thousands of eggs on the planet, a creature inside one of the eggs attacks an explorer. The entire crew is unaware of the impending nightmare set to descend upon them when the alien parasite planted inside its unfortunate host is birthed.",https://image.tmdb.org/t/p/w500//vfrQk5IPloGg1v9Rzbh2Eg3VGyM.jpg,8.163,"Horror, Science Fiction"
1232546,Until Dawn,"One year after her sister Melanie mysteriously disappeared, Clover and her friends head into the remote valley where she vanished in search of answers. Exploring an abandoned visitor center, they find themselves stalked by a masked killer and horrifically murdered one by one…only to wake up and find themselves back at the beginning of the same evening.",https://image.tmdb.org/t/p/w500//6O9nkcmZBymDXtxOGJmulqcxJdv.jpg,6.3,"Horror, Mystery"
297762,Wonder Woman,An Amazon princess comes to the world of Man in the grips of the First World War to confront the forces of evil and bring an end to human conflict.,https://image.tmdb.org/t/p/w500//v4ncgZjG2Zu8ZW5al1vIZTsSjqX.jpg,7.216,"Action, Adventure, Fantasy"
1229730,Carjackers,"By day, they're invisible—valets, hostesses, and bartenders at a luxury hotel. By night, they're the Carjackers, a crew of skilled drivers who track and rob wealthy clients on the road. As they plan their ultimate heist, the hotel director hires a ruthless hitman, to stop them at all costs. With danger closing in, can Nora, Zoe, Steve, and Prestance pull off their biggest score yet?",https://image.tmdb.org/t/p/w500//wbkPMTz2vVai7Ujyp0ag7AM9SrO.jpg,6.119,"Action, Adventure"
1126166,Flight Risk,"A U.S. Marshal escorts a government witness to trial after he's accused of getting involved with a mob boss, only to discover that the pilot who is transporting them is also a hitman sent to assassinate the informant. After they subdue him, they're forced to fly together after discovering that there are others attempting to eliminate them.",https://image.tmdb.org/t/p/w500//q0bCG4NX32iIEsRFZqRtuvzNCyZ.jpg,6.12,"Action, Thriller"
374720,Dunkirk,"The story of the miraculous evacuation of Allied soldiers from Belgium, Britain, Canada and France, who were cut off and surrounded by the German army from the beaches and harbour of Dunkirk between May 26th and June 4th 1940 during World War II.",https://image.tmdb.org/t/p/w500//b4Oe15CGLL61Ped0RAS9JpqdmCt.jpg,7.45,"War, Action, Drama"
1371202,iHostage,"When a gunman enters an Apple Store in the heart of Amsterdam, the police face a delicate challenge to resolve the standoff.",https://image.tmdb.org/t/p/w500//tn3Ckxyc7OWXnhMPkiIBvqLdFC6.jpg,6.102,"Thriller, Crime, Drama"
1096838,Here After,"When her teen daughter displays increasingly disturbing behavior after a near death experience, a mother becomes convinced the girl brought something evil back from the other side.",https://image.tmdb.org/t/p/w500//by3EEDIVTdhNJolYK2Msn1RHRFH.jpg,5.123,"Horror, Thriller"
950396,The Gorge,"Two highly-trained operatives are appointed to posts in guard towers on opposite sides of a vast and highly classified gorge, protecting the world from an undisclosed, mysterious evil that lurks within. They bond from a distance while trying to stay vigilant in defending against an unseen enemy. When the cataclysmic threat to humanity is revealed to them, they must work together in a test of both their physical and mental strength to keep the secret in the gorge before it’s too late.",https://image.tmdb.org/t/p/w500//7iMBZzVZtG0oBug4TfqDb9ZxAOa.jpg,7.732,"Romance, Science Fiction, Thriller"
320288,Dark Phoenix,"The X-Men face their most formidable and powerful foe when one of their own, Jean Grey, starts to spiral out of control. During a rescue mission in outer space, Jean is nearly killed when she's hit by a mysterious cosmic force. Once she returns home, this force not only makes her infinitely more powerful, but far more unstable. The X-Men must now band together to save her soul and battle aliens that want to use Grey's new abilities to rule the galaxy.",https://image.tmdb.org/t/p/w500//cCTJPelKGLhALq3r51A9uMonxKj.jpg,5.972,"Science Fiction, Action, Adventure"
1101401,Sugar Baby,"An enterprising Sugar Baby is offered $30,000 to move in with her Sugar Daddy for the week, but soon discovers the sinister secrets trapped within his home.",https://image.tmdb.org/t/p/w500//z7NyxmdJ1ypn3Y6BVizjGODuBdO.jpg,6.038,"Thriller, Comedy"
284054,Black Panther,"King T'Challa returns home to the reclusive, technologically advanced African nation of Wakanda to serve as his country's new leader. However, T'Challa soon finds that he is challenged for the throne by factions within his own country as well as without. Using powers reserved to Wakandan kings, T'Challa assumes the Black Panther mantle to join with ex-girlfriend Nakia, the queen-mother, his princess-kid sister, members of the Dora Milaje (the Wakandan 'special forces') and an American secret agent, to prevent Wakanda from being dragged into a world war.",https://image.tmdb.org/t/p/w500//uxzzxijgPIY7slzFvMotPv8wjKA.jpg,7.373,"Action, Adventure, Science Fiction"
335988,Transformers: The Last Knight,"Humans and Transformers are at war. Optimus Prime is gone. The key to saving our future lies buried in the secrets of the past, in the hidden history of Transformers on Earth. Saving our world falls upon the shoulders of an unlikely alliance: Cade Yeager; Bumblebee; an English Lord; and an Oxford Professor.",https://image.tmdb.org/t/p/w500//s5HQf2Gb3lIO2cRcFwNL9sn1o1o.jpg,6.1,"Action, Adventure, Science Fiction"
450465,Glass,"In a series of escalating encounters, former security guard David Dunn uses his supernatural abilities to track Kevin Wendell Crumb, a disturbed man who has twenty-four personalities. Meanwhile, the shadowy presence of Elijah Price emerges as an orchestrator who holds secrets critical to both men.",https://image.tmdb.org/t/p/w500//svIDTNUoajS8dLEo7EosxvyAsgJ.jpg,6.663,"Thriller, Drama, Science Fiction"
299534,Avengers: Endgame,"After the devastating events of Avengers: Infinity War, the universe is in ruins due to the efforts of the Mad Titan, Thanos. With the help of remaining allies, the Avengers must assemble once more in order to undo Thanos' actions and restore order to the universe once and for all, no matter what consequences may be in store.",https://image.tmdb.org/t/p/w500//ulzhLuWrPK07P1YkdWQLZnQh1JL.jpg,8.237,"Adventure, Science Fiction, Action"
447273,Snow White,"Following the benevolent King's disappearance, the Evil Queen dominated the once fair land with a cruel streak. Princess Snow White flees the castle when the Queen, in her jealousy over Snow White's inner beauty, tries to kill her. Deep into the dark woods, she stumbles upon seven magical dwarves and a young bandit named Jonathan. Together, they strive to survive the Queen's relentless pursuit and aspire to take back the kingdom in the process.",https://image.tmdb.org/t/p/w500//oLxWocqheC8XbXbxqJ3x422j9PW.jpg,4.543,"Family, Fantasy"
1312833,A Knight's War,"A fearless knight braves a deadly realm to save the Chosen One’s soul. Facing witches, demons, and brutal foes, he discovers her return could ignite chaos and doom humanity.",https://image.tmdb.org/t/p/w500//janjdSMrTRGtPrI1p9uOX66jv7x.jpg,5.3,"Horror, Action, Fantasy"
1055451,Founders Day,A small town is shaken by a series of ominous killings in the days leading up to a heated mayoral election.,https://image.tmdb.org/t/p/w500//ohzLPC9lHUWseBgB7HRcz0GBkFb.jpg,4.4,"Horror, Thriller, Comedy"
1195585,The Hard Hit,"An Interpol agent hunting the head of a global crime syndicate tracks his target to Las Vegas, but when the criminal organization kills his wife and daughter, he goes above the law to get his revenge.",https://image.tmdb.org/t/p/w500//whkFbOZTamHeugEG95jvQehSzAH.jpg,6.778,"Action, Thriller, Crime"
1010581,My Fault,"Noah must leave her city, boyfriend, and friends to move into William Leister's mansion, the flashy and wealthy husband of her mother Rafaela. As a proud and independent 17 year old, Noah resists living in a mansion surrounded by luxury. However, it is there where she meets Nick, her new stepbrother, and the clash of their strong personalities becomes evident from the very beginning.",https://image.tmdb.org/t/p/w500//w46Vw536HwNnEzOa7J24YH9DPRS.jpg,7.8,"Romance, Drama"
1195430,Deva,"Dev Ambre, a ruthless cop, loses his memory in an accident just after he has finished solving a murder case and now has to reinvestigate it while keeping his memory loss a secret from everyone except DCP Farhan Khan.",https://image.tmdb.org/t/p/w500//qxtXzAlEPxmjHILU8k8wduvBSdo.jpg,6.1,"Action, Thriller, Mystery, Crime"
986056,Thunderbolts*,"After finding themselves ensnared in a death trap, seven disillusioned castoffs must embark on a dangerous mission that will force them to confront the darkest corners of their pasts.",https://image.tmdb.org/t/p/w500//c16qiyBKjBFKSVgLr0saiT5pKwd.jpg,8.1,"Action, Adventure, Drama"
206647,Spectre,"A cryptic message from Bond’s past sends him on a trail to uncover a sinister organization. While M battles political forces to keep the secret service alive, Bond peels back the layers of deceit to reveal the terrible truth behind SPECTRE.",https://image.tmdb.org/t/p/w500//zj8ongFhtWNsVlfjOGo8pSr7PQg.jpg,6.558,"Action, Adventure, Thriller"
346685,The Girl on the Train,"Rachel Watson, devastated by her recent divorce, spends her daily commute fantasizing about the seemingly perfect couple who live in a house that her train passes every day, until one morning she sees something shocking happen there and becomes entangled in the mystery that unfolds.",https://image.tmdb.org/t/p/w500//AhTO2QWG0tug7yDoh0XoaMhPt3J.jpg,6.441,"Thriller, Mystery, Drama, Crime"
376867,Moonlight,"The tender, heartbreaking story of a young man’s struggle to find himself, told across three defining chapters in his life as he experiences the ecstasy, pain, and beauty of falling in love, while grappling with his own sexuality.",https://image.tmdb.org/t/p/w500//rcICfiL9fvwRjoWHxW8QeroLYrJ.jpg,7.4,Drama
1297763,Batman Ninja vs. Yakuza League,"The Batman family has returned to the present to discover that Japan has disappeared, and a giant island - Hinomoto - is now in the sky over Gotham City.  At the top sit the Yakuza, a group of superpowered individuals who reign without honor or humanity and look suspiciously like the Justice League. Now, it’s up to Batman and his allies to save Gotham!",https://image.tmdb.org/t/p/w500//sVVT6GYFErVv0Lcc9NvqCu0iOxO.jpg,6.62,"Animation, Action"
